{
  "spec": "enspack/0.1",
  "name": "v1-0-0.qwen--qwen2-5-7b-instruct.mirrors.enspack.eth",
  "model": "qwen--qwen2-5-7b-instruct.mirrors.enspack.eth",
  "publisher": "mirrors.enspack.eth",
  "version": "1.0.0",
  "createdAt": "2026-09-14T00:00:00Z",
  "displayName": "Qwen2.5-7B-Instruct",
  "license": "apache-2.0",
  "licenseUrl": "https://huggingface.co/Qwen/Qwen2.5-7B-Instruct/blob/a09a35458c702b33eeacc393d103063234e8bc28/LICENSE",
  "upstream": {
    "provider": "huggingface",
    "repo": "Qwen/Qwen2.5-7B-Instruct",
    "url": "https://huggingface.co/Qwen/Qwen2.5-7B-Instruct",
    "revision": "a09a35458c702b33eeacc393d103063234e8bc28"
  },
  "canonical": "qwen2-5-7b-instruct.qwen.enspack.eth",
  "distribution": {
    "infohash": "0000000000000000000000000000000000000000",
    "magnet": "magnet:?xt=urn:btih:0000000000000000000000000000000000000000&dn=Qwen2.5-7B-Instruct",
    "torrent": { "cid": "bafkreiaaaaaaaaaaaaaaaaaaaaaaaaaaaaaaaaaaaaaaaaaaaaaaaaaaaaaaaaaa" },
    "webseeds": [
      "https://huggingface.co/Qwen/Qwen2.5-7B-Instruct/resolve/a09a35458c702b33eeacc393d103063234e8bc28/",
      "https://huggingbay.xyz/api/downloads/hf-model-qwen-qwen2-5-7b-instruct/"
    ],
    "hb": "hb://Qwen/Qwen2.5-7B-Instruct@sha256:d82247b7101aea36fd25bc61273bc1d2627d2cc0cb0fd29cb9586044f4e999fd",
    "x-note": "infohash and torrent.cid are placeholders until the bootstrap torrent is created; all file hashes, sizes and the revision are real (HF LFS + Hugging Bay lock, 2026-09-14)."
  },
  "files": [
    {
      "path": ".gitattributes",
      "size": 1519,
      "sha256": "11ad7efa24975ee4b0c3c3a38ed18737f0658a5f75a0a96787b576a78a023361",
      "role": "other"
    },
    {
      "path": "LICENSE",
      "size": 11343,
      "sha256": "832dd9e00a68dd83b3c3fb9f5588dad7dcf337a0db50f7d9483f310cd292e92e",
      "role": "license"
    },
    {
      "path": "README.md",
      "size": 6240,
      "sha256": "f366f33bbf6bcadbb7d87f0a21a7b65584a56b8d58b0743c77c88bee625b93a6",
      "role": "doc"
    },
    {
      "path": "config.json",
      "size": 663,
      "sha256": "7463bb0ea78315365e6c6b74de4e73bbcc8359dfb0c5a737584e077d42c0b03c",
      "role": "config"
    },
    {
      "path": "generation_config.json",
      "size": 243,
      "sha256": "3a8f9087e486054c8a4a08dae2e5a3ba62e23da212b5b8c08bc42cb983c3459f",
      "role": "config"
    },
    {
      "path": "merges.txt",
      "size": 1671839,
      "sha256": "599bab54075088774b1733fde865d5bd747cbcc7a547c5bc12610e874e26f5e3",
      "role": "tokenizer"
    },
    {
      "path": "model-00001-of-00004.safetensors",
      "size": 3945441440,
      "sha256": "a1333e6293854747c481288ea83b348226af178dd565c49b6f9495ba1966aba7",
      "role": "weight"
    },
    {
      "path": "model-00002-of-00004.safetensors",
      "size": 3864726352,
      "sha256": "f5d25a2772cb825164a2a2c0fb6d51a87e282abf21e4dd75bc5cfb3cd0ea6185",
      "role": "weight"
    },
    {
      "path": "model-00003-of-00004.safetensors",
      "size": 3864726424,
      "sha256": "8efdec4c1bc12317ae1a38dc42b595ce777738a64deea3fcb8a0a91381bcdfd5",
      "role": "weight"
    },
    {
      "path": "model-00004-of-00004.safetensors",
      "size": 3556377672,
      "sha256": "1a72d403cdf0c1ec3cb7f289f17b394a01e64394c2e9b3c0f94dbce3faf879bd",
      "role": "weight"
    },
    {
      "path": "model.safetensors.index.json",
      "size": 27752,
      "sha256": "624bf7c47cd12468fdc16e38a47cf4f19e0415b859a223ba3c027eed2f0e1028",
      "role": "index"
    },
    {
      "path": "tokenizer.json",
      "size": 7031645,
      "sha256": "c0382117ea329cdf097041132f6d735924b697924d6f6fc3945713e96ce87539",
      "role": "tokenizer"
    },
    {
      "path": "tokenizer_config.json",
      "size": 7305,
      "sha256": "5b5d4f65d0acd3b2d56a35b56d374a36cbc1c8fa5cf3b3febbbfabf22f359583",
      "role": "tokenizer"
    },
    {
      "path": "vocab.json",
      "size": 2776833,
      "sha256": "ca10d7e9fb3ed18575dd1e277a2579c16d108e32f27439684afa0e10b1440910",
      "role": "tokenizer"
    }
  ],
  "totalSize": 15242807270,
  "versions": [
    {
      "version": "1.0.0",
      "name": "v1-0-0.qwen--qwen2-5-7b-instruct.mirrors.enspack.eth",
      "cid": "bafkreiaaaaaaaaaaaaaaaaaaaaaaaaaaaaaaaaaaaaaaaaaaaaaaaaaaaaaaaaaa",
      "createdAt": "2026-09-14T00:00:00Z"
    }
  ]
}
